{
  "sampleFps": 12,
  "width": 640,
  "height": 360,
  "durationMs": 20000,
  "faceModel": {
    "name": "blaze_face_full_range",
    "sha256": "3698b18f063835bc609069ef052228fbe86d9c9a6dc8dcb7c7c2d69aed2b181b"
  },
  "samples": [
    {
      "atMs": 0,
      "faces": [{ "x": 0.4375, "y": 0.2389, "w": 0.1672, "h": 0.2972, "score": 0.6399 }],
      "bodies": [{ "x": 0.3224, "y": 0.1287, "w": 0.3314, "h": 0.799, "score": 0.7014 }],
      "saliency": { "x": 0.3459, "y": 0.1172, "w": 0.3752, "h": 0.4711, "score": 0.5322 }
    },
    {
      "atMs": 83,
      "faces": [{ "x": 0.4391, "y": 0.2417, "w": 0.1703, "h": 0.3028, "score": 0.7176 }],
      "bodies": [{ "x": 0.3246, "y": 0.1305, "w": 0.3285, "h": 0.7968, "score": 0.7126 }],
      "saliency": { "x": 0.3508, "y": 0.1152, "w": 0.3606, "h": 0.4736, "score": 0.5322 }
    },
    {
      "atMs": 167,
      "faces": [{ "x": 0.4422, "y": 0.2417, "w": 0.1703, "h": 0.3028, "score": 0.6427 }],
      "bodies": [{ "x": 0.328, "y": 0.1323, "w": 0.33, "h": 0.7953, "score": 0.6954 }],
      "saliency": { "x": 0.3542, "y": 0.1178, "w": 0.3713, "h": 0.472, "score": 0.5342 }
    },
    {
      "atMs": 250,
      "faces": [{ "x": 0.4453, "y": 0.2444, "w": 0.1672, "h": 0.2972, "score": 0.6475 }],
      "bodies": [{ "x": 0.3303, "y": 0.1323, "w": 0.3287, "h": 0.7946, "score": 0.682 }],
      "saliency": { "x": 0.3564, "y": 0.1238, "w": 0.3584, "h": 0.4641, "score": 0.5303 }
    },
    {
      "atMs": 333,
      "faces": [{ "x": 0.45, "y": 0.2389, "w": 0.1641, "h": 0.2917, "score": 0.8459 }],
      "bodies": [{ "x": 0.332, "y": 0.1396, "w": 0.331, "h": 0.7865, "score": 0.6879 }],
      "saliency": { "x": 0.3596, "y": 0.1149, "w": 0.366, "h": 0.4739, "score": 0.5312 }
    },
    {
      "atMs": 417,
      "faces": [{ "x": 0.4531, "y": 0.2389, "w": 0.1625, "h": 0.2889, "score": 0.9157 }],
      "bodies": [{ "x": 0.3352, "y": 0.1349, "w": 0.3312, "h": 0.7924, "score": 0.6854 }],
      "saliency": { "x": 0.3623, "y": 0.1136, "w": 0.3555, "h": 0.4763, "score": 0.5312 }
    },
    {
      "atMs": 500,
      "faces": [{ "x": 0.4547, "y": 0.2361, "w": 0.1656, "h": 0.2944, "score": 0.8615 }],
      "bodies": [{ "x": 0.3404, "y": 0.1367, "w": 0.3283, "h": 0.7917, "score": 0.691 }],
      "saliency": { "x": 0.3623, "y": 0.1166, "w": 0.3613, "h": 0.4738, "score": 0.5332 }
    },
    {
      "atMs": 583,
      "faces": [{ "x": 0.4562, "y": 0.2417, "w": 0.1641, "h": 0.2917, "score": 0.8562 }],
      "bodies": [{ "x": 0.3436, "y": 0.1338, "w": 0.3259, "h": 0.7953, "score": 0.6993 }],
      "saliency": { "x": 0.3608, "y": 0.1165, "w": 0.3657, "h": 0.4734, "score": 0.5347 }
    },
    {
      "atMs": 667,
      "faces": [{ "x": 0.4609, "y": 0.2361, "w": 0.1656, "h": 0.2944, "score": 0.9206 }],
      "bodies": [{ "x": 0.3442, "y": 0.129, "w": 0.3281, "h": 0.8019, "score": 0.7023 }],
      "saliency": { "x": 0.3657, "y": 0.1113, "w": 0.3613, "h": 0.4761, "score": 0.5347 }
    },
    {
      "atMs": 750,
      "faces": [{ "x": 0.4641, "y": 0.2389, "w": 0.1641, "h": 0.2917, "score": 0.926 }],
      "bodies": [{ "x": 0.3454, "y": 0.1323, "w": 0.3273, "h": 0.7982, "score": 0.7049 }],
      "saliency": { "x": 0.3652, "y": 0.1154, "w": 0.3564, "h": 0.4755, "score": 0.5337 }
    },
    {
      "atMs": 833,
      "faces": [{ "x": 0.4672, "y": 0.2389, "w": 0.1641, "h": 0.2917, "score": 0.9297 }],
      "bodies": [{ "x": 0.3469, "y": 0.1308, "w": 0.3292, "h": 0.7975, "score": 0.7109 }],
      "saliency": { "x": 0.3647, "y": 0.1149, "w": 0.3604, "h": 0.4788, "score": 0.5347 }
    },
    {
      "atMs": 917,
      "faces": [{ "x": 0.4672, "y": 0.2389, "w": 0.1641, "h": 0.2917, "score": 0.9024 }],
      "bodies": [{ "x": 0.3459, "y": 0.1312, "w": 0.3329, "h": 0.799, "score": 0.7136 }],
      "saliency": { "x": 0.363, "y": 0.1188, "w": 0.364, "h": 0.4739, "score": 0.5352 }
    },
    {
      "atMs": 1000,
      "faces": [{ "x": 0.4703, "y": 0.2389, "w": 0.1641, "h": 0.2917, "score": 0.8758 }],
      "bodies": [{ "x": 0.3515, "y": 0.1323, "w": 0.3267, "h": 0.799, "score": 0.7309 }],
      "saliency": { "x": 0.3562, "y": 0.1147, "w": 0.3699, "h": 0.483, "score": 0.5356 }
    },
    {
      "atMs": 1083,
      "faces": [{ "x": 0.4719, "y": 0.2389, "w": 0.1641, "h": 0.2917, "score": 0.8232 }],
      "bodies": [{ "x": 0.3532, "y": 0.1283, "w": 0.3265, "h": 0.8034, "score": 0.7309 }],
      "saliency": { "x": 0.3433, "y": 0.116, "w": 0.3833, "h": 0.4831, "score": 0.5312 }
    },
    {
      "atMs": 1167,
      "faces": [{ "x": 0.475, "y": 0.2361, "w": 0.1656, "h": 0.2944, "score": 0.9187 }],
      "bodies": [{ "x": 0.356, "y": 0.1345, "w": 0.3259, "h": 0.7946, "score": 0.7418 }],
      "saliency": { "x": 0.3513, "y": 0.1143, "w": 0.3835, "h": 0.4819, "score": 0.5376 }
    },
    {
      "atMs": 1250,
      "faces": [{ "x": 0.4781, "y": 0.2389, "w": 0.1656, "h": 0.2944, "score": 0.9205 }],
      "bodies": [{ "x": 0.3558, "y": 0.136, "w": 0.3287, "h": 0.8136, "score": 0.7228 }],
      "saliency": { "x": 0.3657, "y": 0.116, "w": 0.3687, "h": 0.469, "score": 0.5371 }
    },
    {
      "atMs": 1333,
      "faces": [{ "x": 0.4797, "y": 0.2389, "w": 0.1656, "h": 0.2944, "score": 0.8636 }],
      "bodies": [{ "x": 0.3613, "y": 0.1385, "w": 0.3292, "h": 0.8333, "score": 0.716 }],
      "saliency": { "x": 0.3645, "y": 0.0934, "w": 0.4993, "h": 0.4915, "score": 0.5322 }
    },
    {
      "atMs": 1417,
      "faces": [{ "x": 0.4828, "y": 0.2389, "w": 0.1625, "h": 0.2889, "score": 0.8134 }],
      "bodies": [{ "x": 0.3631, "y": 0.1327, "w": 0.3306, "h": 0.8377, "score": 0.715 }],
      "saliency": { "x": 0.3582, "y": 0.1017, "w": 0.4524, "h": 0.4847, "score": 0.5317 }
    },
    {
      "atMs": 1500,
      "faces": [{ "x": 0.4891, "y": 0.2389, "w": 0.1641, "h": 0.2917, "score": 0.9275 }],
      "bodies": [{ "x": 0.3666, "y": 0.1319, "w": 0.331, "h": 0.8173, "score": 0.7133 }],
      "saliency": { "x": 0.3599, "y": 0.1093, "w": 0.4038, "h": 0.4771, "score": 0.5415 }
    },
    {
      "atMs": 1583,
      "faces": [{ "x": 0.4891, "y": 0.2389, "w": 0.1656, "h": 0.2944, "score": 0.9467 }],
      "bodies": [{ "x": 0.3709, "y": 0.1319, "w": 0.3265, "h": 0.7982, "score": 0.716 }],
      "saliency": { "x": 0.3438, "y": 0.1086, "w": 0.5835, "h": 0.4783, "score": 0.5273 }
    },
    {
      "atMs": 1667,
      "faces": [{ "x": 0.4906, "y": 0.2389, "w": 0.1641, "h": 0.2917, "score": 0.9366 }],
      "bodies": [{ "x": 0.373, "y": 0.1349, "w": 0.3263, "h": 0.7997, "score": 0.7188 }],
      "saliency": { "x": 0.3469, "y": 0.1124, "w": 0.4626, "h": 0.4852, "score": 0.5234 }
    },
    {
      "atMs": 1750,
      "faces": [{ "x": 0.4922, "y": 0.2389, "w": 0.1656, "h": 0.2944, "score": 0.9129 }],
      "bodies": [{ "x": 0.3735, "y": 0.1305, "w": 0.3271, "h": 0.799, "score": 0.7208 }],
      "saliency": { "x": 0.3601, "y": 0.1193, "w": 0.4329, "h": 0.4696, "score": 0.5317 }
    },
    {
      "atMs": 1833,
      "faces": [{ "x": 0.4969, "y": 0.2389, "w": 0.1656, "h": 0.2944, "score": 0.9198 }],
      "bodies": [{ "x": 0.3754, "y": 0.1393, "w": 0.3281, "h": 0.7975, "score": 0.7042 }],
      "saliency": { "x": 0.3735, "y": 0.1173, "w": 0.4258, "h": 0.4696, "score": 0.5332 }
    },
    {
      "atMs": 1917,
      "faces": [{ "x": 0.4984, "y": 0.2389, "w": 0.1641, "h": 0.2917, "score": 0.9249 }],
      "bodies": [{ "x": 0.3792, "y": 0.1393, "w": 0.3279, "h": 0.7961, "score": 0.7003 }],
      "saliency": { "x": 0.376, "y": 0.1161, "w": 0.4121, "h": 0.4654, "score": 0.5361 }
    },
    {
      "atMs": 2000,
      "faces": [{ "x": 0.5, "y": 0.2389, "w": 0.1641, "h": 0.2917, "score": 0.9014 }],
      "bodies": [{ "x": 0.3817, "y": 0.1363, "w": 0.3263, "h": 0.7895, "score": 0.7095 }],
      "saliency": { "x": 0.3877, "y": 0.1232, "w": 0.3687, "h": 0.4447, "score": 0.5405 }
    },
    {
      "atMs": 2083,
      "faces": [{ "x": 0.5016, "y": 0.2389, "w": 0.1656, "h": 0.2944, "score": 0.8817 }],
      "bodies": [{ "x": 0.3831, "y": 0.1396, "w": 0.3275, "h": 0.7829, "score": 0.7024 }],
      "saliency": { "x": 0.3723, "y": 0.1205, "w": 0.3835, "h": 0.4527, "score": 0.5415 }
    },
    {
      "atMs": 2167,
      "faces": [{ "x": 0.5031, "y": 0.2389, "w": 0.1641, "h": 0.2917, "score": 0.8234 }],
      "bodies": [{ "x": 0.3861, "y": 0.1396, "w": 0.3281, "h": 0.7829, "score": 0.6975 }],
      "saliency": { "x": 0.3823, "y": 0.1089, "w": 0.3799, "h": 0.4584, "score": 0.5405 }
    },
    {
      "atMs": 2250,
      "faces": [{ "x": 0.5047, "y": 0.2361, "w": 0.1656, "h": 0.2917, "score": 0.9038 }],
      "bodies": [{ "x": 0.3869, "y": 0.1356, "w": 0.3298, "h": 0.7865, "score": 0.7054 }],
      "saliency": { "x": 0.386, "y": 0.1165, "w": 0.3718, "h": 0.4548, "score": 0.5415 }
    },
    {
      "atMs": 2333,
      "faces": [{ "x": 0.5094, "y": 0.2389, "w": 0.1641, "h": 0.2917, "score": 0.9286 }],
      "bodies": [{ "x": 0.3936, "y": 0.1363, "w": 0.3263, "h": 0.7865, "score": 0.7024 }],
      "saliency": { "x": 0.3901, "y": 0.1059, "w": 0.377, "h": 0.4727, "score": 0.5396 }
    },
    {
      "atMs": 2417,
      "faces": [{ "x": 0.5109, "y": 0.2389, "w": 0.1641, "h": 0.2917, "score": 0.9087 }],
      "bodies": [{ "x": 0.3955, "y": 0.1323, "w": 0.3275, "h": 0.7924, "score": 0.7057 }],
      "saliency": { "x": 0.3997, "y": 0.1094, "w": 0.3694, "h": 0.4755, "score": 0.5405 }
    },
    {
      "atMs": 2500,
      "faces": [{ "x": 0.5109, "y": 0.2361, "w": 0.1672, "h": 0.2972, "score": 0.8537 }],
      "bodies": [{ "x": 0.3962, "y": 0.1323, "w": 0.3285, "h": 0.7909, "score": 0.7049 }],
      "saliency": { "x": 0.3958, "y": 0.1157, "w": 0.365, "h": 0.4664, "score": 0.541 }
    },
    {
      "atMs": 2583,
      "faces": [{ "x": 0.5125, "y": 0.2361, "w": 0.1656, "h": 0.2944, "score": 0.824 }],
      "bodies": [{ "x": 0.3969, "y": 0.1316, "w": 0.3279, "h": 0.7924, "score": 0.7024 }],
      "saliency": { "x": 0.4011, "y": 0.1147, "w": 0.3625, "h": 0.4669, "score": 0.5405 }
    },
    {
      "atMs": 2667,